head,action,tail
angle,means,"The cosine of an angle is equal to the sine of its complementary angle in a right triangle."
sum of squares of sine and cosine of an angle,means,"The sum of the squares of the sine and cosine of an angle in a right triangle is always equal to 1."
sine and cosine functions,means,"The sine and cosine functions are periodic with a period of 360 degrees or 2π radians."
sine and cosine functions,means,"The sine and cosine functions have a range of [-1, 1] and are both continuous and differentiable for all real numbers."
distance between two points formula,means,"The distance formula between two points (x1, y1) and (x2, y2) is √((x2 - x1)² + (y2 - y1)²)."
midpoint between two points formula,means,"The midpoint formula between two points (x1, y1) and (x2, y2) is ((x1 + x2)/2, (y1 + y2)/2)."
distance from a point to a line formula,means,"The distance between a point (x, y) and a line Ax + By + C = 0 is |Ax + By + C| / √(A² + B²)."
slope of a line passing through two points formula,means,"The slope of a line passing through points (x1, y1) and (x2, y2) is (y2 - y1) / (x2 - x1)."
definition of perpendicular lines,means,"Two lines are perpendicular if the product of their slopes is -1."
midpoint formula,means,"The midpoint formula states that the coordinates of the midpoint between two points (x1, y1) and (x2, y2) is ((x1 + x2)/2, (y1 + y2)/2)."
midpoint of a line segment,means,"The midpoint of a line segment divides the segment into two equal parts."
distance formula,means,"The distance formula can be used to find the length of a line segment given its endpoints."
segment addition postulate,belongs to,"The segment addition postulate states that if three points A, B, and C are collinear, and B is between A and C, then AB + BC = AC."
bisector of a line segment,means,"The bisector of a line segment divides the segment into two equal parts."
distance formula between two points,belongs to,"The distance formula between two points (x1, y1) and (x2, y2) on the coordinate plane is given by d = √((x2 - x1)^2 + (y2 - y1)^2)."
midpoint formula,means,"To find the midpoint of a line segment with endpoints (x1, y1) and (x2, y2), use the midpoint formula: ((x1 + x2)/2, (y1 + y2)/2)."
Pythagorean Theorem,means,"The Pythagorean Theorem can be used to find the distance between two points on the coordinate plane by treating the x and y coordinates as the legs of a right triangle and the distance as the hypotenuse."
distance between a point and a line formula,belongs to,"The distance between a point (x, y) and a line ax + by + c = 0 is given by d = |ax + by + c| / √(a^2 + b^2)."
equation of a circle,means,"To find the equation of a circle with center (h, k) and radius r on the coordinate plane, the equation is (x-h)^2 + (y-k)^2 = r^2."
parallel lines,belongs to,"The slope of parallel lines is equal, while the slope of perpendicular lines is the negative reciprocal of each other."
slope-intercept form,means,"The equation of a line in slope-intercept form is y = mx + b, where m is the slope and b is the y-intercept."
slope of a line passing through two points,means,"To find the slope of a line passing through two given points (x1, y1) and (x2, y2), use the formula (y2 - y1)/(x2 - x1)."
parallel lines,belongs to,"Two lines are parallel if they have the same slope and different y-intercepts."
perpendicular lines,belongs to,"Two lines are perpendicular if the product of their slopes is -1."
slope,means,"The equation of parallel lines can be found by keeping the slope the same and changing the y-intercept."
slope,means,"The equation of perpendicular lines can be found by taking the negative reciprocal of the slope of one line."
slope,belongs to,"Parallel lines have the same slope, but different y-intercepts."
slope,belongs to,"Perpendicular lines have slopes that are negative reciprocals of each other."
slope,belongs to,"When two lines are parallel, they have the same slope but different y-intercepts."
circle equation centered at the origin,belongs to,"The equation of a circle centered at the origin is x^2 + y^2 = r^2, where r is the radius."
general form of the equation of a circle,belongs to,"The general form of the equation of a circle is Ax^2 + Ay^2 + Cx + Dy + E = 0, where A and B are the coefficients of x^2 and y^2, respectively."
standard form of the equation of a circle,belongs to,"The standard form of the equation of a circle can be obtained by completing the square for x and y terms."
graph of a circle,means,"The graph of a circle is always symmetrical about its center point."
standard equation of a circle,means,"The standard equation of a circle is (x-h)^2 + (y-k)^2 = r^2, where (h, k) is the center of the circle and r is the radius."
center-radius form of the equation,means,"The center-radius form of the equation allows us to easily determine the center and radius of a circle."
general form of the equation,means,"The equation can also be written in general form as x^2 + y^2 + Dx + Ey + F = 0, where D, E, and F are constants."
graph of a circle,means,"The graph of a circle is always symmetric with respect to its center."
distance between the center of a circle and any point on the circle,means,"The distance between the center of a circle and any point on the circle is always equal to the radius."
circle equation,means,"The expanded form of a circle's equation is x^2 + y^2 + Dx + Ey + F = 0."
coefficients of a circle equation,belongs to,"To expand the equation of a circle, the coefficients D, E, and F can be calculated using the original equation."
components of the circle equation,means,"The expanded form of a circle's equation allows for a clearer understanding of its components."
center and radius of a circle,belongs to,"The expanded equation of a circle can be used to easily find the center and radius of the circle."
coefficients D and E,means,"In the expanded form, the coefficients D and E represent the coordinates of the center of the circle."
focus of a parabola,means,"The focus of a parabola is a fixed point (F) inside the curve."
directrix of a parabola,means,"The directrix of a parabola is a fixed line perpendicular to the axis of symmetry."
distance from a point on the parabola to the focus,means,"The distance from a point on the parabola to the focus is equal to the distance to the directrix."
equation of a parabola,means,"The equation of a parabola with focus (x1, y1) and directrix ax + by + c = 0 is (x - x1)^2 + (y - y1)^2 = a(x + by + c)^2."
shape and position of a parabola,means,"The focus and directrix of a parabola help determine its shape and position in the coordinate plane."
circumference of a circle,means,"The circumference of a circle is equal to 2π times the radius."
area of a circle,means,"The area of a circle is equal to π times the square of the radius."
diameter of a circle,means,"The diameter of a circle is equal to twice the radius."
chord of a circle,belongs to,"The chord of a circle is a line segment that connects two points on the circle."
radius of a circle,belongs to,"The radius of a circle is a line segment that connects the center of the circle to any point on the circle."
circle arc,belongs to,"An arc is a part of a circle defined by two endpoints and the points on the circle between them."
arc measure,means,"The measure of an arc is the measure of the central angle that intercepts the arc."
minor arc measure,means,"The measure of a minor arc is always less than 180 degrees."
semicircle arc measure,means,"The measure of a semicircle arc is always 180 degrees."
major arc measure,means,"The measure of a major arc is always greater than 180 degrees."
arc length formula,means,"Arc length formula: The arc length of a circle is equal to the ratio of the measure of the central angle (in degrees) to 360, multiplied by the circumference of the circle."
arc measure degree formula,means,"Arc measure degree formula: To find the measure of an arc in degrees, use the formula Arc Length = (Arc Measure/360) x (2 x π x r), where r is the radius of the circle."
central angle theorem,means,"Central angle theorem: The measure of a central angle is the same as the measure of the arc it intersects."
inscribed angle theorem,means,"Inscribed angle theorem: The measure of an inscribed angle is half the measure of the arc it intersects."
relationships between angles and arc lengths in circles,belongs to,"Understanding these formulas and theorems can help in calculating and understanding the relationships between angles and arc lengths in circles."
radian,belongs to,"A radian is a unit of angular measurement that is defined as the angle subtended by an arc of a circle that has the same length as the radius of the circle."
degrees,means,"One radian is equivalent to approximately 57.3 degrees."
circumference of a circle,belongs to,"The circumference of a circle is equal to 2π times the radius, or π times the diameter."
relationship between degrees and radians,means,"The relationship between degrees and radians is given by the formula radians = degrees * π / 180."
trigonometry and calculus,means,"Radians are used in trigonometry and calculus to simplify calculations involving circular motion and periodic functions."
arc length formula,belongs to,"The formula for arc length in radians is: length = radius x angle (in radians)."
distance along the circumference of a circle covered by an arc,belongs to,"Arc length is the measure of the distance along the circumference of a circle covered by an arc of a certain angle."
arc length,means,"Arc length is always dependent on the radius of the circle and the angle in radians."
length of an arc in radians,means,"To find the length of an arc in radians, you must measure the angle in radians first."
arc length units in radians,means,"The arc length units in radians are related to the circumference of the circle by the formula arc length = (angle in radians/2π) x circumference."
sector of a circle,belongs to,"The area of a sector of a circle can be calculated by finding the fraction of the circle represented by the central angle and then multiplying by the area of the whole circle."
sector of a circle,belongs to,"The arc length of a sector of a circle can be calculated by finding the fraction of the circle represented by the central angle and then multiplying by the circumference of the whole circle."
sector,means,"The central angle of a sector can be calculated by finding the ratio of the arc length to the circumference of the whole circle and then multiplying by 360 degrees."
radius and central angle of a sector,means,"The radius and central angle of a sector are related by the formula: arc length = radius x central angle (in radians)."
sectors formed by dividing a circle with a chord,belongs to,"The sum of the areas of two sectors formed by dividing a circle with a chord is equal to the area of the original circle."
inscribed angle,belongs to,"The measure of an inscribed angle is half the measure of the intercepted arc."
congruent inscribed angles,means,"Inscribed angles that intercept the same arc are congruent to each other."
inscribed angle theorem,means,"The inscribed angle theorem states that an angle inscribed in a semicircle is a right angle."
tangent line to a circle,belongs to,"A tangent line to a circle is perpendicular to the radius drawn to the point of tangency."
inscribed right angle,means,"The measure of an inscribed right angle is 90 degrees."
central angle of a circle,means,"The central angle of a circle is equal to the measure of its intercepted arc."
inscribed angle,means,"The measure of an inscribed angle is half the measure of its intercepted arc."
triangle inscribed in a circle,belongs to,"The sum of the angles in any triangle inscribed in a circle is always 180 degrees."
perpendicular bisector of a chord in a circle,belongs to,"The perpendicular bisector of a chord in a circle passes through the center of the circle."
line connecting the center of a circle to the midpoint of a chord,means,"The line connecting the center of a circle to the midpoint of a chord is always perpendicular to the chord."
central angle of a circle,means,"The central angle of a circle is twice the inscribed angle if they both intercept the same arc."
inscribed angle,means,"The measure of an inscribed angle is half the measure of the intercepted arc."
cyclic quadrilateral,means,"The opposite angles of a cyclic quadrilateral are supplementary."
triangle inscribed in a circle,means,"The sum of the angles in a triangle inscribed in a circle is always 180 degrees."
tangent line to a circle,means,"The radius of a circle is perpendicular to a tangent line drawn to the circle at the point of contact."
tangent to a circle,belongs to,"A line that is tangent to a circle is perpendicular to the radius of the circle at the point of tangency."
radius drawn to the point of tangency,belongs to,"The radius drawn to the point of tangency is also perpendicular to the tangent line."
tangent segments from the same external point,means,"Tangent segments from the same external point are congruent."
angle formed by a tangent and a chord,means,"The measure of the angle formed by a tangent and a chord is half the measure of the intercepted arc."
tangent line to a circle,belongs to,"The tangent line to a circle is the only line that intersects the circle at exactly one point."
central angle of a regular polygon,belongs to,"The central angle of a regular polygon inscribed in a circle is equal to 360 degrees divided by the number of sides in the polygon."
measure of each interior angle of a regular polygon,means,"The measure of each interior angle of a regular polygon inscribed in a circle can be calculated using the formula 180 - (360/n) where n is the number of sides."
radius of the circle inscribed in a regular polygon,means,"The radius of the circle inscribed in a regular polygon can be found by using the formula r = s / (2 * tan(π/n)) where s is the side length of the polygon and n is the number of sides."
all sides of a regular polygon,means,"All sides of a regular polygon inscribed in a circle are equal in length."
sum of the exterior angles of a regular polygon,means,"The sum of the exterior angles of a regular polygon is always 360 degrees, regardless of the number of sides."
circumcircle of a triangle,belongs to,"The circumcircle of a triangle is a circle that passes through all three vertices of the triangle."
center of the circumcircle of a triangle,means,"The center of the circumcircle of a triangle is the point where the perpendicular bisectors of the sides of the triangle intersect."
incircle of a triangle,belongs to,"The incircle of a triangle is a circle that is tangent to all three sides of the triangle."
center of the incircle of a triangle,means,"The center of the incircle of a triangle is the point where the angle bisectors of the triangle intersect."
radius of the incircle of a triangle,belongs to,"The radius of the incircle of a triangle is equal to the area of the triangle divided by its semiperimeter."
point of tangency,belongs to,"A line tangent to a circle touches the circle at only one point, known as the point of tangency."
tangent to a circle,means,"The tangent to a circle is perpendicular to the radius drawn to the point of tangency."
tangent line to a circle,means,"The tangent line to a circle is always longer than the radius of the circle."
tangent lines from the same external point,means,"Tangent lines to a circle from the same external point are congruent."
radius drawn to the point of tangency,means,"The radius drawn to the point of tangency is perpendicular to the tangent line."
dimensions,belongs to,"The main difference between 2D and 3D objects is the number of dimensions they have - 2D objects exist in two dimensions (length and width) while 3D objects exist in three dimensions (length, width, and height)."
surface area of a 2D object,means,"The formula for the surface area of a 2D object, such as a square or triangle, is different from the formula for the surface area of a 3D object, such as a cube or sphere."
volume of a 2D object,means,"The volume of a 2D object is always zero since it does not have any height or depth, while the volume of a 3D object can be calculated using formulas like V = lwh for a rectangular prism."
perimeter of a 2D object,means,"The perimeter of a 2D object can be found by adding up the lengths of all its sides, while the surface area of a 3D object can be found by adding up the areas of all its surfaces."
solid geometry,means,"In solid geometry, understanding the differences between 2D and 3D objects is crucial for accurately calculating measurements such as surface area and volume."
Cavalieri's principle,belongs to,"Cavalieri's principle states that if two solids have equal heights and cross-sectional areas at every level, then their volumes are equal."
method of dissection,belongs to,"The method of dissection involves breaking down a complex solid into simpler ones, calculating their volumes individually, and then adding them together to find the total volume."
volume of a cylinder,means,"The volume of a cylinder can be calculated using the formula V = πr^2h, where r is the radius of the base and h is the height."
volume of a cone,means,"The volume of a cone can be calculated using the formula V = (1/3)πr^2h, where r is the radius of the base and h is the height."
principles and methods of solid geometry,belongs to,"These principles and methods are integral to understanding and solving problems involving solid geometry in high school mathematics."
cube volume,means,"The volume of a cube is given by the formula V = s^3, where s represents the length of a side."
rectangular prism surface area,belongs to,"The surface area of a rectangular prism can be found using the formula SA = 2lw + 2lh + 2wh, where l, w, and h are the length, width, and height of the prism."
cylinder volume,means,"The volume of a cylinder can be calculated using the formula V = πr^2h, where r is the radius of the base and h is the height of the cylinder."
cone surface area,belongs to,"The surface area of a cone can be determined with the formula SA = πr^2 + πrs, where r is the radius of the base and s is the slant height of the cone."
sphere volume,means,"The volume of a sphere can be calculated using the formula V = (4/3)πr^3, where r is the radius of the sphere."
solid object density,belongs to,The density of a solid object is defined as the mass of the object divided by its volume.
density formula,means,The formula for calculating density is: Density = Mass/Volume.
volume of a solid object,means,In geometry, the volume of a solid object can be calculated by finding the number of cubic units that can fit inside the object.
volume of common solid shapes formulas,means,The volume of common solid shapes such as cubes, cylinders, and spheres can be determined using specific formulas.
Density importance in physics and engineering,means,Density is an important concept in physics and engineering as it helps determine the mass of materials used in constructions and other applications.
