head,action,tail
rigid motion,belongs to,"Any rigid motion can be described as a translation, rotation, or reflection in Euclidean geometry."
congruent figures,means,"Two figures are considered congruent if one can be obtained from the other through a sequence of rigid motions."
rotation over intersecting lines,belongs to,"The composition of two reflections over intersecting lines results in a rotation."
translation over parallel lines,belongs to,"The composition of two reflections over parallel lines results in a translation."
glide reflection,means,"The composition of a rotation and a reflection results in a glide reflection."
rigid transformation,belongs to,"A rigid transformation in geometry is a transformation that does not change the size or shape of a figure."
types of rigid transformations,belongs to,"The three main types of rigid transformations are translations, rotations, and reflections."
formula for a translation,means,"The formula for a translation is (x,y) → (x+a, y+b), where (a,b) represents the amount and direction of the translation."
rotation,means,"A rotation involves rotating a figure around a fixed point by a certain degree."
reflection,means,"A reflection is a transformation that flips a figure over a line of reflection."
translation,belongs to,"A translation is a transformation that moves every point of a figure the same distance and in the same direction."
coordinate rules for translations,means,"The coordinate rules for translations are (x + a, y + b) where a represents the horizontal shift and b represents the vertical shift."
translations,means,"Translations preserve the size and shape of the original figure, but not the orientation."
inverse of a translation,belongs to,"The inverse of a translation is another translation with the same magnitude but in the opposite direction."
translations,belongs to,"Translations can be performed on any type of geometric figure, including points, lines, and polygons."
property of rotations,means,"One property of rotations is that the distance between any two points on a figure remains the same after the rotation."
rotation formula,means,"The formula for a rotation of point (x, y) about the origin by angle θ is (x', y') = (x*cosθ - y*sinθ, x*sinθ + y*cosθ)."
composition of two rotations,means,"The composition of two rotations is another rotation, with the resulting angle equal to the sum of the angles of the individual rotations."
rotations,means,"A rotation is an isometry, meaning it preserves distance and angles, making it a rigid transformation."
angle of rotation,means,"The angle of rotation can be positive or negative, with a positive angle resulting in a counterclockwise rotation and a negative angle resulting in a clockwise rotation."
point reflection,belongs to,"The reflection of a point over a line is the same distance from the line as the original point."
line of reflection,belongs to,"The line of reflection is the perpendicular bisector of the segment connecting a point and its reflection."
point reflection over the x-axis,means,"The formula for reflecting a point (x,y) over the x-axis is (x,-y) and over the y-axis is (-x,y)."
point reflection over the line y=x,means,"The formula for reflecting a point (x,y) over the line y=x is (y,x) and over the line y=-x is (-y,-x)."
reflections,means,"Reflections preserve distance and angle measure, making them an isometry in geometry."
dilation,belongs to,"A dilation is a transformation that changes the size of a figure without changing its shape."
scale factor of a dilation,means,"The scale factor of a dilation determines how much the figure will be enlarged or reduced."
center of dilation,means,"The center of dilation is the fixed point about which the figure expands or contracts."
similar figures under a dilation,means,"The image of a figure under a dilation will always be similar to the original figure, meaning the corresponding angles are congruent and the corresponding sides are proportional."
performing dilations using coordinates,means,"Dilations can be performed using coordinates by multiplying the coordinates by the scale factor to find the new coordinates of the image."
distances and angles in a figure,means,"A rigid transformation preserves distances and angles between points in a figure."
size or shape of a figure,means,"Rigid transformations do not change the size or shape of a figure, only its position and orientation."
congruent figures,belongs to,"Two figures that are congruent can be transformed into one another through a series of rigid transformations."
proving geometrical properties,means,"Rigid transformations are essential in proving geometrical properties and theorems."
center of dilation,belongs to,"A dilation is a transformation that involves scaling a figure by a fixed ratio about a fixed point called the center of dilation."
angle preservation during dilation,means,"When a figure is dilated, the angle measure between any two intersecting lines is preserved, meaning the angles before and after dilation are congruent."
scaling factor in dilation,means,"The distance between any two points on a figure is scaled by the same factor as the sides of the figure during a dilation."
effects of scale factor in dilation,means,"If a figure is dilated by a scale factor greater than 1, then the image will be larger than the original figure."
shape preservation in dilation,means,"Dilation does not change the shape of a figure, it only changes the size of the figure by a proportionate amount."
types of transformations in geometry,belongs to,"Translations, rotations, reflections, and dilations are the four basic types of transformations in geometry."
congruence of a transformed figure,means,"The image of a figure after a transformation is congruent to the original figure if the transformation is an isometry."
similarity transformation,means,"A transformation that preserves angles but not necessarily lengths is called a similarity transformation."
representations of transformations,means,"Transformations can be represented by matrices, equations, or by using vector notation."
line of symmetry,belongs to,"The line of symmetry of a figure divides it into two equal halves that are reflections of each other."
symmetry in geometry,means,"Symmetry in geometry refers to the property that a figure remains unchanged when flipped, slid, or rotated."
symmetrical object,means,"An object is symmetrical if it can be divided into two equal parts that are mirror images of each other."
center of symmetry,belongs to,"The point of intersection of lines of symmetry in a figure is called the center of symmetry."
order of rotational symmetry,means,"The order of rotational symmetry of a figure is the number of times it can be rotated without changing its appearance."
distance and angle measures,means,"The rigid motion transformation preserves distance and angle measures between objects in geometry."
composition of transformations,means,"The composition of two or more transformations can be represented as a single transformation."
congruent figures,means,"Two figures are congruent if one can be mapped onto the other using only rigid motions."
properties of transformations,means,"The properties of reflections, rotations, translations, and dilations can be used to prove geometric theorems."
transformations proofs,means,"Proofs involving transformations often involve showing that one figure can be transformed into another through a series of defined transformations."
figures are congruent,means,"Theorem: If two figures are congruent, then their corresponding angles and sides are congruent as well."
Congruence transformations,means,"Property: Congruence transformations preserve angle measures, side lengths, and orientation of a figure."
geometric figure,means,"Axiom: The reflexive property states that any geometric figure is congruent to itself."
distance between two points,means,"Formula: The formula for the distance between two points (x1, y1) and (x2, y2) is √((x2-x1)^2 + (y2-y1)^2)."
triangles with three congruent sides,means,"Theorem: If two triangles have three congruent sides, then they are congruent."
triangles,means,"Two triangles are congruent if their corresponding angles and sides are equal in measure."
congruence transformations,belongs to,"The three basic congruence transformations are translation, rotation, and reflection."
SAS congruence postulate,means,"The side-angle-side (SAS) congruence postulate states that if two sides and the included angle of one triangle are congruent to two sides and the included angle of another triangle, then the triangles are congruent."
ASA congruence postulate,means,"The angle-side-angle (ASA) congruence postulate states that if two angles and the included side of one triangle are congruent to two angles and the included side of another triangle, then the triangles are congruent."
HL congruence postulate,means,"The hypotenuse-leg (HL) congruence postulate states that if the hypotenuse and a leg of one right triangle are congruent to the hypotenuse and a leg of another right triangle, then the triangles are congruent."
SSS Postulate,means,"The Side-Side-Side (SSS) Postulate states that if three sides of one triangle are congruent to three sides of another triangle, then the two triangles are congruent."
SAS Postulate,means,"The Side-Angle-Side (SAS) Postulate states that if two sides and the included angle of one triangle are congruent to two sides and the included angle of another triangle, then the two triangles are congruent."
ASA Postulate,means,"The Angle-Side-Angle (ASA) Postulate states that if two angles and the included side of one triangle are congruent to two angles and the included side of another triangle, then the two triangles are congruent."
HL Theorem,means,"The Hypotenuse-Leg (HL) Theorem states that if the hypotenuse and a leg of one right triangle are congruent to the hypotenuse and a leg of another right triangle, then the two right triangles are congruent."
Isosceles Triangle Theorem,means,"The Isosceles Triangle Theorem states that if two sides of a triangle are congruent, then the angles opposite those sides are congruent."
interior angles of a triangle,belongs to,"The Angle Sum Theorem states that the sum of the interior angles of a triangle is always 180 degrees."
side and included angle of a triangle,means,"The Side-Angle-Side (SAS) Congruence Theorem states that if two sides and the included angle of one triangle are congruent to two sides and the included angle of another triangle, then the triangles are congruent."
all three sides of two triangles,means,"The Side-Side-Side (SSS) Congruence Theorem states that if all three sides of one triangle are congruent to all three sides of another triangle, then the triangles are congruent."
hypotenuse and one leg of two right triangles,means,"The right triangle congruence theorem (hypotenuse-leg) states that if the hypotenuse and one leg of a right triangle are congruent to the hypotenuse and one leg of another right triangle, then the triangles are congruent."
Isosceles triangle,means,"The Isosceles Triangle Theorem states that if two sides of a triangle are congruent, then the angles opposite those sides are also congruent."
Side-Side-Side (SSS) congruence theorem,means,"The Side-Side-Side (SSS) congruence theorem states that if three sides of one triangle are congruent to three sides of another triangle, then the triangles are congruent."
Side-Angle-Side (SAS) congruence theorem,means,"The Side-Angle-Side (SAS) congruence theorem states that if two sides and the included angle of one triangle are congruent to two sides and the included angle of another triangle, then the triangles are congruent."
Angle-Side-Angle (ASA) congruence theorem,means,"The Angle-Side-Angle (ASA) congruence theorem states that if two angles and the included side of one triangle are congruent to two angles and the included side of another triangle, then the triangles are congruent."
Hypotenuse-Leg (HL) congruence theorem,means,"The Hypotenuse-Leg (HL) congruence theorem is specific to right triangles and states that if the hypotenuse and a leg of one right triangle are congruent to the hypotenuse and a leg of another right triangle, then the triangles are congruent."
Angle-Angle-Side (AAS) congruence theorem,means,"The Angle-Angle-Side (AAS) congruence theorem states that if two angles and a non-included side of one triangle are congruent to two angles and a non-included side of another triangle, then the triangles are congruent."
parallelogram,belongs to,"The opposite sides of a parallelogram are congruent."
parallelogram,belongs to,"The opposite angles of a parallelogram are congruent."
rhombus,means,"The diagonals of a rhombus are perpendicular and bisect each other."
rectangle,belongs to,"The diagonals of a rectangle are congruent."
square,means,"The diagonals of a square are perpendicular and bisect each other at right angles."
angle bisector theorem,means,"The angle bisector theorem states that a line segment drawn from the vertex of an angle to the opposite side will divide the angle into two equal parts."
perpendicular bisector theorem,means,"The perpendicular bisector theorem states that any point on the perpendicular bisector of a segment is equidistant from the endpoints of the segment."
perpendicular lines,means,"Two lines are perpendicular if the angle between them is 90 degrees."
symmetrical property of equality,means,"The symmetrical property of equality states that if two angles or sides are congruent, then their images under a symmetry are also congruent."
triangle angle sum theorem,means,"The triangle angle sum theorem states that the sum of the interior angles of a triangle is always 180 degrees."
similarity,belongs to,"Two figures are similar if they have the same shape but not necessarily the same size."
ratio of corresponding side lengths in similar figures,means,"The ratio of corresponding side lengths in similar figures is always constant."
congruent corresponding angles of similar figures,means,"Similar figures have congruent corresponding angles."
similar figures,means,"If two figures are similar, then their corresponding angles are congruent and their corresponding sides are proportional."
symbol "∼" for similarity,means,"Similarity can be denoted with the symbol "∼" and is important for solving problems involving proportions and scaling."
similar triangles,belongs to,"Two triangles are considered similar if their corresponding angles are congruent and their corresponding sides are proportional."
Side-Splitting Theorem,means,"The Side-Splitting Theorem states that a line parallel to one side of a triangle will intersect the other two sides proportionally."
Triangle Proportionality Theorem,means,"The Triangle Proportionality Theorem states that if a line is parallel to one side of a triangle, it divides the other two sides proportionally."
Ratio of Sides Theorem,means,"The Ratio of Sides Theorem can be used to find the lengths of sides of similar triangles when the scale factor is known."
similar triangles,means,"The properties of similar triangles are that corresponding angles are congruent and corresponding sides are proportional."
AA similarity postulate,means,"The AA (Angle-Angle) similarity postulate states that if two angles of one triangle are congruent to two angles of another triangle, then the triangles are similar."
SAS similarity theorem,means,"The SAS (Side-Angle-Side) similarity theorem states that if two sides of one triangle are proportional to two sides of another triangle, and their included angles are congruent, then the triangles are similar."
SSS similarity theorem,means,"The SSS (Side-Side-Side) similarity theorem states that if the lengths of the corresponding sides of two triangles are proportional, then the triangles are similar."
triangle proportionality theorem,means,"The triangle proportionality theorem states that if a line is parallel to one side of a triangle and intersects the other two sides, then it divides those sides proportionally, creating similar triangles."
angle bisector theorem,belongs to,"In a triangle, the angle bisector theorem states that the angle bisector divides the opposite side into segments that are proportional to the adjacent sides."
angle bisector theorem formula,means,"The formula for the angle bisector theorem is expressed as: a/b = c/d, where a and b are the lengths of the intersected segments and c and d are the lengths of the adjacent sides."
use of angle bisector theorem,means,"This theorem can be used to find missing side lengths or angle measures in similar triangles."
fundamental concept in understanding properties of similar triangles,means,"The angle bisector theorem is a fundamental concept in understanding the properties of similar triangles."
application of angle bisector theorem in geometric problems,means,"It is essential to apply the angle bisector theorem accurately in geometric problems to determine ratios and proportions among triangle components."
similar triangles,means,"The properties of similar triangles include corresponding angles being congruent and corresponding sides being in proportion."
Side-Splitter Theorem,means,"The Side-Splitter Theorem states that if a line is parallel to one side of a triangle and intersects the other two sides, it divides those sides proportionally."
AA Similarity Theorem,means,"The Angle-Angle (AA) Similarity Theorem states that if two angles of one triangle are congruent to two angles of another triangle, then the triangles are similar."
SAS Similarity Theorem,means,"The Side-Angle-Side (SAS) Similarity Theorem states that if two sides of one triangle are proportional to two sides of another triangle and the included angles are congruent, then the triangles are similar."
Geometric Mean Theorem,means,"The Geometric Mean Theorem states that in a right triangle, the altitude drawn to the hypotenuse is the geometric mean between the segments it divides the hypotenuse into."
similarity properties,means,"The properties of similarity state that corresponding angles are congruent, corresponding sides are proportional, and all similar triangles are the same shape."
scale factor formula,means,"The formula for finding the scale factor of similar figures is the ratio of corresponding side lengths."
Side-Splitter Theorem,means,"The Side-Splitter Theorem states that if a line is parallel to one side of a triangle, it divides the other two sides proportionally."
Angle Bisector Theorem,means,"The Angle Bisector Theorem states that if an angle bisector in a triangle intersects the opposite side, it divides that side into segments proportional to the other two sides."
Triangle Proportionality Theorem,means,"The Triangle Proportionality Theorem states that if a line parallel to one side of a triangle intersects the other two sides, it creates segments on those sides that are proportional to the lengths of the original sides."
side-splitter theorem,means,"The side-splitter theorem states that a line parallel to one side of a triangle divides the other two sides proportionally."
AA similarity postulate,means,"The AA (Angle-Angle) similarity postulate states that if two angles of one triangle are congruent to two angles of another triangle, then the triangles are similar."
SAS similarity theorem,means,"The SAS (Side-Angle-Side) similarity theorem states that if two triangles have two pairs of corresponding sides that are proportional and their included angles are congruent, then the triangles are similar."
SSS similarity theorem,means,"The SSS (Side-Side-Side) similarity theorem states that if the corresponding sides of two triangles are proportional, then the triangles are similar."
modeling problems with similar and congruent triangles,means,"When solving modeling problems with similar and congruent triangles, it is important to use proportions to find missing side lengths and angle measures."
right triangle,means,"In a right triangle, the Pythagorean theorem states that the square of the length of the hypotenuse is equal to the sum of the squares of the lengths of the other two sides."
Pythagorean theorem formula,belongs to,"The formula for the Pythagorean theorem is a^2 + b^2 = c^2, where a and b are the lengths of the legs of the triangle and c is the length of the hypotenuse."
ancient Greek mathematician Pythagoras,means,"The Pythagorean theorem is named after the ancient Greek mathematician Pythagoras, who is credited with its discovery."
geometry,means,"The Pythagorean theorem is essential in geometry for determining the lengths of sides in right triangles."
Trigonometry,means,"Trigonometry, which deals with the relationships between the sides and angles of triangles, often relies on the Pythagorean theorem for calculations."
right triangle,means,"In a right triangle, the sum of the squares of the two shorter sides is equal to the square of the hypotenuse, known as the Pythagorean theorem."
Pythagorean theorem,means,"The Pythagorean theorem can be proved using similar triangles or algebraic equations."
converse of the Pythagorean theorem,means,"The converse of the Pythagorean theorem states that if the sum of the squares of two sides is equal to the square of the third side, then the triangle is a right triangle."
Pythagorean triples,means,"Pythagorean triples are sets of three integers that satisfy the Pythagorean theorem, such as (3, 4, 5) and (5, 12, 13)."
fundamental concept in geometry,belongs to,"The Pythagorean theorem is one of the most fundamental concepts in geometry and has applications in various fields, such as physics and engineering."
45-45-90 triangle,means,"In a 45-45-90 triangle, the two legs are congruent and the hypotenuse is √2 times the length of each leg."
30-60-90 triangle,means,"In a 30-60-90 triangle, the short leg is half the length of the hypotenuse and the longer leg is √3 times the length of the short leg."
Pythagorean theorem,means,"The Pythagorean theorem can be used to find the missing sides of special right triangles by squaring the lengths of the legs and adding them together to find the length of the hypotenuse."
special right triangles,belongs to,"The special right triangles have angles of 45 degrees, 45 degrees, and 90 degrees (for the isosceles right triangle) or angles of 30 degrees, 60 degrees, and 90 degrees (for the 30-60-90 triangle)."
trigonometric functions simplification,belongs to,"Special right triangles can be used to simplify trigonometric functions and make calculations easier in geometry and trigonometry problems."
Pythagorean Theorem,means,"The Pythagorean Theorem states that in a right triangle, the square of the length of the hypotenuse is equal to the sum of the squares of the other two sides."
sine ratio,means,"The sine ratio in a right triangle is defined as the ratio of the length of the side opposite the given angle to the length of the hypotenuse."
cosine ratio,means,"The cosine ratio in a right triangle is defined as the ratio of the length of the side adjacent to the given angle to the length of the hypotenuse."
tangent ratio,means,"The tangent ratio in a right triangle is defined as the ratio of the length of the side opposite the given angle to the length of the side adjacent to the angle."
inverse trigonometric functions,belongs to,"The inverse trigonometric functions, such as sine^(-1), cos^(-1), and tan^(-1), can be used to find the measure of an angle in a right triangle given the lengths of the sides."
trigonometric ratios in a right triangle,belongs to,"The trigonometric ratios in a right triangle are sine, cosine, and tangent."
sine of an angle in a right triangle,means,"The sine of an angle in a right triangle is the ratio of the length of the side opposite the angle to the length of the hypotenuse."
cosine of an angle in a right triangle,means,"The cosine of an angle in a right triangle is the ratio of the length of the side adjacent to the angle to the length of the hypotenuse."
tangent of an angle in a right triangle,means,"The tangent of an angle in a right triangle is the ratio of the length of the side opposite the angle to the length of the side adjacent to the angle."
Pythagorean Theorem,means,"The Pythagorean Theorem states that in a right triangle, the square of the length of the hypotenuse is equal to the sum of the squares of the lengths of the other two sides."
solving for a side in a right triangle using trigonometry,means,"To solve for a side in a right triangle using trigonometry, you can use the sine, cosine, or tangent ratio depending on the information given."
using the sine ratio,means,"To use the sine ratio, divide the length of the side opposite the given angle by the length of the hypotenuse."
using the cosine ratio,means,"To use the cosine ratio, divide the length of the side adjacent to the given angle by the length of the hypotenuse."
sine ratio,belongs to,"The sine ratio is defined as the ratio of the length of the side opposite a given angle to the length of the hypotenuse in a right triangle."
cosine ratio,belongs to,"The cosine ratio is defined as the ratio of the length of the side adjacent to a given angle to the length of the hypotenuse in a right triangle."
tangent ratio,belongs to,"The tangent ratio is defined as the ratio of the length of the side opposite a given angle to the length of the side adjacent to the same angle in a right triangle."
Pythagorean Theorem,means,"The Pythagorean Theorem states that the square of the length of the hypotenuse in a right triangle is equal to the sum of the squares of the lengths of the other two sides."
angle in a right triangle,means,"To solve for an angle in a right triangle using trigonometric ratios, apply the inverse trigonometric functions (arcsin, arccos, arctan) to find the measure of the angle."
angle,means,"The sine of an angle is equal to the cosine of its complementary angle in a right triangle."
